{"cover":{"title":"企业本地优先 AI 助理落地研究报告","subtitle":"研究报告","client":"国家电网有限公司","issuer":"研究中心","compiler":"信息化研究组","version":"V1.0","security_level":"内部资料","date":"2026-07-15"},"sections":[{"sectionId":"sec-1","title":"研究问题","paragraphs":[{"text":"本报告研究企业本地优先 AI 助理的落地边界。"}]}],"tables":[],"images":[]}
